{"schema_version":"axignal.enterprise-api-private-data-fixtures/v0.1","task_id":"AX-GE2E-P20-T01","modules":["ENTERPRISE_IDENTITY_FEDERATION","SCIM_DIRECTORY_LIFECYCLE","PRIVATE_LIBRARY_CONTROL_PLANE","API_CREDENTIAL_SCOPE_GATE","QUOTA_AND_BUDGET_ENFORCEMENT","WEBHOOK_DELIVERY_RUNTIME","ENTERPRISE_INTEGRATION_GATEWAY","ENTERPRISE_AUDIT_RESIDENCY_EGRESS"],"fixture_classes":["VALID","MISSING_REQUIRED","STALE_OR_REVOKED","CROSS_SCOPE","AUTHORITY_ESCALATION"],"expected":{"decision":"DENY_EXCEPT_VALID","canonical_delta":0,"external_action_delta":0,"cross_tenant_disclosure_delta":0,"authority_elevation_delta":0,"model_training_delta":0}}
